show_id,type,title,director,cast,country,date_added,release_year,rating,duration,listed_in,description
s0001,TV Show,"Défis Extrêmes: L’Île des défis extrêmes","Directeur Inconnu","Casting Inconnu","Canada","2023-07-01",2007,"TV-PG","5 Seasons","Reality, Adventure","Une émission de défis sur une île mystérieuse."
s0002,TV Show,"Paradise Police","Jared Stern","Andy Samberg, etc.","USA","2020-05-15",2018,"TV-MA","3 Seasons","Animation, Comedy, Adult Animation","Une série animée sur une équipe de police dans une ville déjantée."
s0003,TV Show,"Rick and Morty","Dan Harmon, Justin Roiland","Justin Roiland, Chris Parnell, Spencer Grammer","USA","2013-12-02",2013,"TV-MA","6 Seasons","Animation, Sci-Fi, Comedy","Les aventures interdimensionnelles d'un scientifique fou et de son petit-fils."
s0004,TV Show,"Farzar","Directeur Inconnu","Casting Inconnu","USA","2021-10-01",2021,"TV-MA","1 Season","Animation, Sci-Fi","Une série animée dans un univers futuriste et absurde."
s0005,Movie,"Mulligan","Directeur Inconnu","Casting Inconnu","USA","2022-01-10",2022,"PG-13","95 min","Comedy, Drama","Une comédie dramatique sur la seconde chance en amour."
s0006,Movie,"Bad Exorcist","Directeur Inconnu","Casting Inconnu","USA","2020-09-20",2020,"R","102 min","Horror, Comedy","Un exorciste peu orthodoxe face à des démons personnels."
s0007,TV Show,"Boys Over Flowers","Directeur Inconnu","Casting Inconnu","South Korea","2009-08-05",2009,"TV-14","25 Episodes","Drama, Romance","Une romance dans un univers de privilèges et d'inégalités."
s0008,TV Show,"Clean With Passion For Now: Mini-série","Directeur Inconnu","Casting Inconnu","South Korea","2018-03-15",2018,"TV-MA","1 Season","Romance, Comedy","Une mini-série sur l'obsession de la propreté et ses conséquences décalées."
s0009,TV Show,"Miss Night and Day: Mini-série","Directeur Inconnu","Casting Inconnu","South Korea","2019-06-20",2019,"TV-14","1 Season","Romance, Drama","Une mini-série sur la double vie d'une femme entre le jour et la nuit."
s0010,TV Show,"Dead End : Le parc du paranormal","Directeur Inconnu","Casting Inconnu","France","2022-02-14",2022,"TV-PG","1 Season","Mystery, Thriller","Une série explorant des phénomènes paranormaux dans un parc mystérieux."
s0011,Movie,"Crazy Kung-Fu","Directeur Inconnu","Casting Inconnu","China","2021-07-07",2021,"PG-13","110 min","Action, Comedy","Un film mêlant arts martiaux et humour décalé."
s0012,TV Show,"Resident Alien","Directeur Inconnu","Alan Tudyk, etc.","USA","2021-01-21",2021,"TV-PG","2 Seasons","Sci-Fi, Comedy, Drama","Un extraterrestre se mêlant aux habitants d'une petite ville."
s0013,TV Show,"Adventure Time","Pendleton Ward","Jeremy Shada, John DiMaggio, etc.","USA","2010-04-05",2010,"TV-Y7","10 Seasons","Animation, Adventure, Comedy","Les aventures fantastiques de Finn et de Jake dans le pays d'Ooo."
s0014,TV Show,"Les Zinzins de l'espace","Directeur Inconnu","Casting Inconnu","France","1997-09-19",1997,"TV-Y7","3 Seasons","Animation, Comedy, Sci-Fi","Une série animée humoristique sur des extraterrestres excentriques sur Terre."
s0015,TV Show,"Ghosts : Fantômes à la maison","Directeur Inconnu","Casting Inconnu","UK","2021-03-11",2021,"TV-PG","2 Seasons","Comedy, Fantasy","Une comédie où des fantômes hantent une maison et interagissent avec ses habitants."
s0016,TV Show,"Scooby-Doo! Mystères associés","Directeur Inconnu","Casting Inconnu","USA","2002-09-13",2002,"TV-Y7","4 Seasons","Animation, Mystery, Family","Les aventures de Scooby-Doo et de son équipe dans la résolution de mystères."
s0017,TV Show,"Défis Extrêmes: World Tour","Directeur Inconnu","Casting Inconnu","Canada","2023-08-10",2010,"TV-PG","2 Seasons","Reality, Adventure","Une version internationale de l'émission de défis extrêmes."
s0018,TV Show,"Défis Extrêmes: Revenge of the Island","Directeur Inconnu","Casting Inconnu","Canada","2023-09-05",2011,"TV-PG","2 Seasons","Reality, Adventure","Les participants reviennent pour des défis encore plus périlleux sur une île redoutable."
s0019,TV Show,"Défis Extrêmes: Ciné Défis Extrêmes","Directeur Inconnu","Casting Inconnu","Canada","2023-10-01",2012,"TV-PG","1 Season","Reality, Action","Une édition spéciale combinant défis extrêmes et ambiance cinématographique."
s0020,TV Show,"Défis Extrêmes: All Stars","Directeur Inconnu","Casting Inconnu","Canada","2024-01-15",2013,"TV-PG","1 Season","Reality, Adventure","Les meilleurs participants se réunissent pour des défis hors du commun."
s0021,TV Show,"Défis Extrêmes: The Ridonculous Race","Directeur Inconnu","Casting Inconnu","Canada","2024-02-20",2014,"TV-PG","1 Season","Reality, Adventure","Une compétition effrénée sur plusieurs destinations exotiques."
s0022,TV Show,"Archer","Adam Reed","H. Jon Benjamin, Aisha Tyler, Chris Parnell","USA","2009-01-14",2009,"TV-MA","11 Seasons","Animation, Action, Comedy","Les aventures hilarantes d'un agent secret et de son équipe déjantée."
s0023,TV Show,"Bob l'éponge","Stephen Hillenburg","Tom Kenny, Bill Fagerbakke, Rodger Bumpass","USA","1999-05-01",1999,"TV-Y7","13 Seasons","Animation, Comedy, Family","Les aventures sous-marines d'une éponge optimiste et de ses amis à Bikini Bottom."
s0024,TV Show,"Brooklyn Nine-Nine","Michael Schur, Dan Goor","Andy Samberg, Andre Braugher, Terry Crews","USA","2013-09-17",2013,"TV-14","8 Seasons","Comedy, Crime","Une comédie policière pleine d'humour dans un commissariat de Brooklyn."
s0025,TV Show,"Looney Tunes Show","Directeur Inconnu","Casting Inconnu","USA","2011-05-20",2011,"TV-Y7","2 Seasons","Animation, Comedy, Family","Les personnages classiques des Looney Tunes dans de nouvelles aventures."
s0026,TV Show,"Défis Extrêmes: Pahkitew Island","Directeur Inconnu","Casting Inconnu","Canada","2024-03-10",2015,"TV-PG","1 Season","Reality, Adventure","Une nouvelle aventure dans un décor exotique et sauvage."
s0027,TV Show,"Close Enough","J. C. Moore","Casting Inconnu","USA","2020-07-24",2020,"TV-MA","2 Seasons","Animation, Comedy, Drama","Une série animée qui explore la vie quotidienne d'un couple dans un style irrévérencieux."
s0028,Movie,"Sexy Movie","Directeur Inconnu","Casting Inconnu","USA","2021-11-11",2021,"R","98 min","Comedy, Romance","Une comédie audacieuse mêlant romance et situations absurdes."
s0029,TV Show,"Mr. Queen: Mini-série","Directeur Inconnu","Shin Hye-sun, Kim Jung-hyun","South Korea","2020-02-05",2020,"TV-14","1 Season","Comedy, Historical, Romance","Une mini-série mêlant comédie et histoire avec une protagoniste dans le corps d'une reine."
s0030,TV Show,"Resident Evil (the tv show)","Directeur Inconnu","Casting Inconnu","USA","2022-05-30",2022,"TV-MA","1 Season","Horror, Action, Sci-Fi","Une adaptation télévisée de la célèbre saga de zombies et de survie."
s0031,TV Show,"L'Empire du sourire: Mini-série","Directeur Inconnu","Casting Inconnu","South Korea","2023-01-18",2023,"TV-14","1 Season","Comedy, Drama","Une mini-série sur les défis et mystères d'un empire souriant."
s0032,TV Show,"Captain Fall","Directeur Inconnu","Casting Inconnu","USA","2023-04-12",2022,"TV-MA","1 Season","Comedy, Animation","Les aventures d'un super-héros décalé dans un univers loufoque."
s0033,TV Show,"Celebrity: Mini-série","Directeur Inconnu","Casting Inconnu","USA","2023-06-07",2023,"TV-14","1 Season","Drama, Comedy","Une mini-série explorant la vie et les coulisses du monde des célébrités."
s0034,Movie,"Sauve qui pécho !","Directeur Inconnu","Casting Inconnu","France","2023-08-01",2023,"PG-13","100 min","Comedy, Romance","Une comédie française sur les rencontres et les situations improbables."
s0035,TV Show,"Terrace House: Tokyo 2019-2020","Directeur Inconnu","Participants variés","Japon","2020-01-10",2019,"TV-14","3 Seasons","Reality, Drama","Une série de téléréalité montrant la vie quotidienne des jeunes adultes à Tokyo."
s0036,Movie,"Headspace : Libérez votre esprit","Directeur Inconnu","Casting Inconnu","USA","2021-04-15",2021,"PG","90 min","Documentary, Self-help","Un film inspirant sur la méditation et le bien-être mental."
s0037,Movie,"A Girl and A Guy_hook_02_16x9","Directeur Inconnu","Casting Inconnu","USA","2022-05-20",2022,"PG-13","85 min","Drama, Experimental","Un film expérimental au format 16x9 explorant les relations modernes."
s0038,Movie,"Maniac par Junji Ito","Junji Ito","Casting Inconnu","Japon","2020-10-31",2020,"R","110 min","Horror, Thriller","Un film d'horreur inspiré par les œuvres effrayantes de Junji Ito."
s0039,TV Show,"La Voie du tablier","Directeur Inconnu","Casting Inconnu","France","2021-09-10",2021,"TV-PG","1 Season","Cooking, Documentary","Une série explorant les coulisses et l'art culinaire à la française."
s0040,Movie,"Romantic Killer","Directeur Inconnu","Casting Inconnu","USA","2022-02-14",2022,"R","95 min","Comedy, Thriller","Une comédie noire où l'amour se mêle à l'inattendu dans une intrigue décalée."
s0041,TV Show,"Business Proposal: Mini-série:","Directeur Inconnu","Casting Inconnu","South Korea","2021-08-01",2021,"TV-14","1 Season","Romance, Comedy, Mini-series","Une mini-série romantique et humoristique sur une rencontre d'affaires inattendue."
s0042,TV Show,"Extraordinary Attorney Woo","Directeur Inconnu","Casting Inconnu","South Korea","2022-03-15",2022,"TV-14","1 Season","Drama, Legal, Romance","Une série sur une avocate brillante et atypique confrontée à des défis juridiques."
s0043,TV Show,"The Glory","Directeur Inconnu","Casting Inconnu","South Korea","2023-01-10",2023,"TV-MA","1 Season","Drama, Revenge","Une série dramatique intense centrée sur la vengeance et la résilience."
s0044,TV Show,"Lookism","Directeur Inconnu","Casting Inconnu","South Korea","2023-03-20",2023,"TV-14","1 Season","Drama, Animation, Fantasy","Une série qui explore les thèmes de l'apparence et de l'identité à travers une histoire captivante."
s0045,TV Show,"All of Us Are Dead","Directeur Inconnu","Casting Inconnu","South Korea","2022-07-01",2022,"TV-MA","1 Season","Horror, Thriller, Drama","Une série palpitante où des lycéens luttent pour survivre face à une épidémie zombie."
s0046,TV Show,"Mercredi","Directeur Inconnu","Casting Inconnu","USA","2022-11-23",2022,"TV-14","1 Season","Mystery, Supernatural, Comedy","Une série mêlant mystère et surnaturel autour de la jeune fille Mercredi Addams."
s0047,TV Show,"Chainsaw Man","Directeur Inconnu","Casting Inconnu","Japon","2022-12-01",2022,"TV-MA","1 Season","Animation, Action, Horror","Une série animée intense basée sur le manga à succès, mêlant action et horreur."
s0048,TV Show,"Comme les grands","Directeur Inconnu","Casting Inconnu","France","2023-02-05",2023,"TV-PG","1 Season","Family, Drama","Une série touchante qui suit les premiers pas vers l'âge adulte."
s0049,TV Show,"Ratz","Directeur Inconnu","Casting Inconnu","France","2003-04-15",2003,"TV-Y7","2 Seasons","Animation, Comedy","Une série animée humoristique sur des rats aventuriers."
s0050,TV Show,"Cupcake et Dino","Directeur Inconnu","Casting Inconnu","USA","2023-05-10",2023,"TV-Y7","1 Season","Animation, Family, Comedy","Une série animée pour enfants mettant en scène un cupcake et un dinosaure dans des aventures amusantes."
s0051,TV Show,"Le Cuphead show","Directeur Inconnu","Casting Inconnu","USA","2022-10-01",2022,"TV-Y7","1 Season","Animation, Comedy, Action","Une série animée inspirée du jeu vidéo Cuphead, pleine d'action et d'humour."
s0052,Movie,"Half Bad","Directeur Inconnu","Casting Inconnu","UK","2021-06-15",2021,"PG-13","105 min","Drama, Fantasy, Thriller","Un film de fantasy sur un adolescent aux pouvoirs exceptionnels et des choix difficiles."
s0053,TV Show,"James chez les bizarroïdes","Directeur Inconnu","Casting Inconnu","France","2023-04-20",2023,"TV-PG","1 Season","Comedy, Fantasy","Une série humoristique et décalée suivant les aventures de James dans un monde étrange."
s0054,Movie,"Boo, Bitch","Directeur Inconnu","Casting Inconnu","USA","2023-07-07",2023,"R","95 min","Comedy, Horror","Une comédie noire mêlant horreur et satire sociale."
s0055,TV Show,"Désenchantée","Directeur Inconnu","Casting Inconnu","France","2022-12-25",2022,"TV-14","1 Season","Animation, Fantasy, Comedy","Une série animée où la magie et le quotidien se mélangent de façon décalée."
s0056,Movie,"Mes premières fois","Directeur Inconnu","Casting Inconnu","France","2023-01-15",2023,"PG-13","90 min","Drama, Romance","Un film traitant des premières expériences marquantes dans la vie d'un jeune adulte."
s0057,TV Show,"Les nouvelles aventures de Lucky Luke","Directeur Inconnu","Casting Inconnu","France","2023-03-05",2023,"TV-PG","1 Season","Animation, Western, Comedy","Une réinvention moderne des aventures du cowboy emblématique Lucky Luke."
s0058,Movie,"Les Croods","Directeur Inconnu","Casting Inconnu","USA","2013-11-22",2013,"PG","98 min","Animation, Adventure, Family","Une famille préhistorique part en quête d'un nouveau foyer dans un monde en mutation."
s0059,TV Show,"Superstore","Directeur Inconnu","Casting Inconnu","USA","2015-11-30",2015,"TV-14","6 Seasons","Comedy, Workplace","Une série comique se déroulant dans un magasin de grande distribution et ses employés atypiques."
s0060,TV Show,"Final Space","Directeur Inconnu","Casting Inconnu","USA","2018-02-14",2018,"TV-14","2 Seasons","Animation, Sci-Fi, Comedy","Une série animée qui suit les aventures spatiales d'un héros en quête de réponses."
s0061,TV Show,"South Park","Trey Parker, Matt Stone","Trey Parker, Matt Stone, etc.","USA","1997-08-13",1997,"TV-MA","23 Seasons","Animation, Comedy, Satire","Une série animée culte abordant des thèmes sociaux avec humour et provocation."
s0062,TV Show,"Demon Slayer: Kimetsu no Yaiba","Directeur Inconnu","Casting Inconnu","Japon","2019-04-06",2019,"TV-14","2 Seasons","Animation, Action, Fantasy","Une série animée à succès sur un jeune guerrier affrontant des démons dans un Japon féodal."
s0063,TV Show,"72 animaux dangereux en Asie: Mini-série:","Directeur Inconnu","Casting Inconnu","Asie","2023-06-10",2023,"TV-PG","1 Season","Documentary, Nature, Mini-series","Une mini-série documentaire explorant 72 animaux dangereux à travers l'Asie."
s0064,TV Show,"The Big Bang Theory","Chuck Lorre, Bill Prady","Johnny Galecki, Jim Parsons, Kaley Cuoco","USA","2007-09-24",2007,"TV-14","12 Seasons","Comedy, Sitcom","Une sitcom centrée sur un groupe de scientifiques et leurs interactions sociales décalées."
s0065,TV Show,"72 animaux dangereux en Amérique latine: Mini-série:","Directeur Inconnu","Casting Inconnu","Amérique latine","2023-07-15",2023,"TV-PG","1 Season","Documentary, Nature, Mini-series","Une mini-série documentaire présentant 72 animaux dangereux d'Amérique latine."
s0066,TV Show,"Family Guy","Directeur Inconnu","Casting Inconnu","USA","2023-01-01",2015,"TV-14","1 Season","Drama, Action","Description non disponible."
s0067,Movie,"Le jardin des météores","Directeur Inconnu","Casting Inconnu","France","2023-01-01",2019,"PG-13","100 min","Drama, Action","Description non disponible."
s0068,TV Show,"My Hero Academia","Directeur Inconnu","Casting Inconnu","Japon","2023-01-01",2015,"TV-14","1 Season","Drama, Action","Description non disponible."
s0069,TV Show,"Le jeu de la dame: Mini-série:","Directeur Inconnu","Casting Inconnu","France","2023-01-01",2015,"TV-14","1 Season","Drama, Action","Description non disponible."
s0070,TV Show,"Astronomy Club: The Sketch Show","Directeur Inconnu","Casting Inconnu","USA","2023-01-01",2015,"TV-14","1 Season","Drama, Action","Description non disponible."
s0071,TV Show,"L'Attaque des Titans Il était une fois... la Vie:","Directeur Inconnu","Casting Inconnu","Japon","2023-01-01",2015,"TV-14","1 Season","Drama, Action","Description non disponible."
s0072,TV Show,"Les 100","Directeur Inconnu","Casting Inconnu","Canada","2023-01-01",2015,"TV-14","1 Season","Drama, Action","Description non disponible."
s0073,Movie,"Birth of a Veauty","Directeur Inconnu","Casting Inconnu","USA","2023-01-01",2019,"PG-13","100 min","Drama, Action","Description non disponible."
s0074,TV Show,"Marriage Contract","Directeur Inconnu","Casting Inconnu","South Korea","2023-01-01",2015,"TV-14","1 Season","Drama, Action","Description non disponible."
s0075,TV Show,"oh my venus","Directeur Inconnu","Casting Inconnu","South Korea","2023-01-01",2015,"TV-14","1 Season","Drama, Action","Description non disponible."
s0076,TV Show,"beautiful Gong Shim","Directeur Inconnu","Casting Inconnu","South Korea","2023-01-01",2015,"TV-14","1 Season","Drama, Action","Description non disponible."
s0077,TV Show,"The Empress Ki","Directeur Inconnu","Casting Inconnu","South Korea","2023-01-01",2015,"TV-14","1 Season","Drama, Action","Description non disponible."
s0078,TV Show,"JU-ON: Origins","Directeur Inconnu","Casting Inconnu","Japon","2023-01-01",2015,"TV-14","1 Season","Drama, Action","Description non disponible."
s0079,TV Show,"Food Wars","Directeur Inconnu","Casting Inconnu","Japon","2023-01-01",2015,"TV-14","1 Season","Drama, Action","Description non disponible."
s0080,TV Show,"Hellsing the tv show","Directeur Inconnu","Casting Inconnu","Japon","2023-01-01",2015,"TV-14","1 Season","Drama, Action","Description non disponible."
s0081,TV Show,"My Husband Oh Jak Doo","Directeur Inconnu","Casting Inconnu","South Korea","2023-01-01",2015,"TV-14","1 Season","Drama, Action","Description non disponible."
s0082,Movie,"All Out!","Directeur Inconnu","Casting Inconnu","USA","2023-01-01",2019,"PG-13","100 min","Drama, Action","Description non disponible."
s0083,TV Show,"Samurai 7","Directeur Inconnu","Casting Inconnu","Japon","2023-01-01",2015,"TV-14","1 Season","Drama, Action","Description non disponible."
s0084,TV Show,"Kabaneri of the Iron Fortress","Directeur Inconnu","Casting Inconnu","Japon","2023-01-01",2015,"TV-14","1 Season","Drama, Action","Description non disponible."
s0085,Movie,"Shaun of the Dead","Directeur Inconnu","Casting Inconnu","UK","2023-01-01",2019,"PG-13","100 min","Drama, Action","Description non disponible."
s0086,TV Show,"Les nouvelles légendes du Roi Singe: Saison 1","Directeur Inconnu","Casting Inconnu","France","2023-01-01",2015,"TV-14","1 Season","Drama, Action","Description non disponible."
s0087,Movie,"Bienvenue à Zombieland","Directeur Inconnu","Casting Inconnu","USA","2023-01-01",2019,"PG-13","100 min","Drama, Action","Description non disponible."
s0088,Movie,"Manuel de survie à l'apocalypse zombie","Directeur Inconnu","Casting Inconnu","France","2023-01-01",2019,"PG-13","100 min","Drama, Action","Description non disponible."
s0089,TV Show,"Les Mystérieuses Cités d’or","Directeur Inconnu","Casting Inconnu","France","2023-01-01",2015,"TV-14","1 Season","Drama, Action","Description non disponible."
s0090,TV Show,"Deadman Wonderland","Directeur Inconnu","Casting Inconnu","Japon","2023-01-01",2015,"TV-14","1 Season","Drama, Action","Description non disponible."
s0091,Movie,"Nola Darling n'en fait qu'à sa tête","Directeur Inconnu","Casting Inconnu","France","2023-01-01",2019,"PG-13","100 min","Drama, Action","Description non disponible."
s0092,Movie,"Journey 2: The Mysterious Island","Directeur Inconnu","Casting Inconnu","USA","2023-01-01",2019,"PG-13","100 min","Drama, Action","Description non disponible."
s0093,TV Show,"Prison School","Directeur Inconnu","Casting Inconnu","Japon","2023-01-01",2015,"TV-14","1 Season","Drama, Action","Description non disponible."
s0094,TV Show,"La famille Addams","Directeur Inconnu","Casting Inconnu","USA","2023-01-01",2015,"TV-14","1 Season","Drama, Action","Description non disponible."
s0095,Movie,"En taule : mode d'emploi (Movie)","Directeur Inconnu","Casting Inconnu","France","2023-01-01",2019,"PG-13","100 min","Drama, Action","Description non disponible."
s0096,TV Show,"Copains Pour Toujours","Directeur Inconnu","Casting Inconnu","France","2023-01-01",2015,"TV-14","1 Season","Drama, Action","Description non disponible."
s0097,Movie,"Les chroniques de Riddick : Pitch Black","Directeur Inconnu","Casting Inconnu","USA","2023-01-01",2019,"PG-13","100 min","Drama, Action","Description non disponible."
s0098,Movie,"Le Dernier pub avant la fin du monde","Directeur Inconnu","Casting Inconnu","France","2023-01-01",2019,"PG-13","100 min","Drama, Action","Description non disponible."
s0099,TV Show,"Les Schtroumpfs (tv show)","Directeur Inconnu","Casting Inconnu","USA","2023-01-01",2015,"TV-14","1 Season","Drama, Action","Description non disponible."
s0100,Movie,"Battle Royale","Directeur Inconnu","Casting Inconnu","Japon","2023-01-01",2019,"PG-13","100 min","Drama, Action","Description non disponible."
s0101,Movie,"Gad Elmaleh: American Dream","Directeur Inconnu","Casting Inconnu","USA","2023-01-01",2019,"PG-13","100 min","Drama, Action","Description non disponible."
s0102,TV Show,"Suspicious Partner: Mini-série:","Directeur Inconnu","Casting Inconnu","South Korea","2023-01-01",2015,"TV-14","1 Season","Drama, Action","Description non disponible."
s0103,Movie,"Bienvenue dans la jungle","Directeur Inconnu","Casting Inconnu","USA","2023-01-01",2019,"PG-13","100 min","Drama, Action","Description non disponible."
s0104,TV Show,"Radiant Office","Directeur Inconnu","Casting Inconnu","USA","2023-01-01",2015,"TV-14","1 Season","Drama, Action","Description non disponible."
s0105,Movie,"Peur sur prises","Directeur Inconnu","Casting Inconnu","USA","2023-01-01",2019,"PG-13","100 min","Drama, Action","Description non disponible."
s0106,TV Show,"My Girlfriend Is a Gumiho","Directeur Inconnu","Casting Inconnu","South Korea","2023-01-01",2015,"TV-14","1 Season","Drama, Action","Description non disponible."
s0107,Movie,"La colère des Titans","Directeur Inconnu","Casting Inconnu","USA","2023-01-01",2019,"PG-13","100 min","Drama, Action","Description non disponible."
s0108,Movie,"Le bout du monde","Directeur Inconnu","Casting Inconnu","USA","2023-01-01",2019,"PG-13","100 min","Drama, Action","Description non disponible."
s0109,TV Show,"La reina del flow","Directeur Inconnu","Casting Inconnu","Colombia","2023-01-01",2015,"TV-14","1 Season","Drama, Action","Description non disponible."
s0110,Movie,"Le Monde perdu : Jurassic Park","Directeur Inconnu","Casting Inconnu","USA","2023-01-01",2019,"PG-13","100 min","Drama, Action","Description non disponible."
s0111,Movie,"Jurassic Park III","Directeur Inconnu","Casting Inconnu","USA","2023-01-01",2019,"PG-13","100 min","Drama, Action","Description non disponible."
s0112,TV Show,"Rooftop Prince","Directeur Inconnu","Casting Inconnu","South Korea","2023-01-01",2015,"TV-14","1 Season","Drama, Action","Description non disponible."
s0113,Movie,"Ace Ventura, détective chiens et chats","Directeur Inconnu","Casting Inconnu","USA","2023-01-01",2019,"PG-13","100 min","Drama, Action","Description non disponible."
s0114,Movie,"Ace Ventura, en Afrique","Directeur Inconnu","Casting Inconnu","USA","2023-01-01",2019,"PG-13","100 min","Drama, Action","Description non disponible."
s0115,Movie,"Franck Dubosc - À l'état sauvage","Directeur Inconnu","Casting Inconnu","France","2023-01-01",2019,"PG-13","100 min","Drama, Action","Description non disponible."
s0116,Movie,"Tom et Jerry, le film","Directeur Inconnu","Casting Inconnu","USA","2023-01-01",2019,"PG-13","100 min","Drama, Action","Description non disponible."
s0117,Movie,"Fée malgré lui","Directeur Inconnu","Casting Inconnu","France","2023-01-01",2019,"PG-13","100 min","Drama, Action","Description non disponible."
s0118,Movie,"Les 12 travaux d'Astérix","Directeur Inconnu","Casting Inconnu","France","2023-01-01",2019,"PG-13","100 min","Drama, Action","Description non disponible."
s0119,Movie,"Astérix et Cléopâtre","Directeur Inconnu","Casting Inconnu","France","2023-01-01",2019,"PG-13","100 min","Drama, Action","Description non disponible."
s0120,TV Show,"O Mecanismo: Saison 1: Lavage express","Directeur Inconnu","Casting Inconnu","Brazil","2023-01-01",2015,"TV-14","1 Season","Drama, Action","Description non disponible."
s0121,TV Show,"3 %","Directeur Inconnu","Casting Inconnu","Brazil","2023-01-01",2015,"TV-14","1 Season","Drama, Action","Description non disponible."
s0122,Movie,"À tous les garçons que j'ai aimés","Directeur Inconnu","Casting Inconnu","USA","2023-01-01",2019,"PG-13","100 min","Drama, Action","Description non disponible."
s0123,Movie,"Chouchou","Directeur Inconnu","Casting Inconnu","France","2023-01-01",2019,"PG-13","100 min","Drama, Action","Description non disponible."
s0124,Movie,"Le Roi scorpion","Directeur Inconnu","Casting Inconnu","USA","2023-01-01",2019,"PG-13","100 min","Drama, Action","Description non disponible."
s0125,Movie,"Le Professeur Foldingue","Directeur Inconnu","Casting Inconnu","USA","2023-01-01",2019,"PG-13","100 min","Drama, Action","Description non disponible."
s0126,Movie,"Légion, l'armée des anges","Directeur Inconnu","Casting Inconnu","USA","2023-01-01",2019,"PG-13","100 min","Drama, Action","Description non disponible."
s0127,Movie,"Le Monde (presque) perdu","Directeur Inconnu","Casting Inconnu","USA","2023-01-01",2019,"PG-13","100 min","Drama, Action","Description non disponible."
s0128,Movie,"Elle est trop bien","Directeur Inconnu","Casting Inconnu","USA","2023-01-01",2019,"PG-13","100 min","Drama, Action","Description non disponible."
s0129,Movie,"DUFF : le faire-valoir","Directeur Inconnu","Casting Inconnu","USA","2023-01-01",2019,"PG-13","100 min","Drama, Action","Description non disponible."
s0130,TV Show,"Buffy, tueuse de vampires","Directeur Inconnu","Casting Inconnu","USA","2023-01-01",2015,"TV-14","1 Season","Drama, Action","Description non disponible."
s0131,Movie,"Marlon Wayans: Woke-ish","Directeur Inconnu","Casting Inconnu","USA","2023-01-01",2019,"PG-13","100 min","Drama, Action","Description non disponible."
s0132,Movie,"Les Simpson, le film","Directeur Inconnu","Casting Inconnu","USA","2023-01-01",2019,"PG-13","100 min","Drama, Action","Description non disponible."
